{
  "id": "job_0123",
  "project_id": "proj_001",
  "type": "transcribe",
  "status": "running",
  "progress": 0.42,
  "stage": "transcribing",
  "error_code": null,
  "error_message": null,
  "params": {"model": "large-v3", "device": "cuda"},
  "created_at": "2026-08-10T10:00:00Z",
  "started_at": "2026-08-10T10:00:01Z",
  "finished_at": null
}
